{
  "$schema": "https://json-schema.org/draft/2020-12/schema",
  "type": "object",
  "properties": {
    "id": {
      "type": "string",
      "pattern": "^[a-z0-9-]+$"
    },
    "out_dir": {
      "type": "string",
      "minLength": 1
    },
    "environment": {
      "type": "object",
      "properties": {
        "name": {
          "type": "string",
          "minLength": 1
        },
        "kind": {
          "type": "string",
          "enum": [
            "live",
            "test"
          ]
        },
        "test_copy": {
          "default": false,
          "type": "boolean"
        },
        "seeded_data": {
          "default": false,
          "type": "boolean"
        }
      },
      "required": [
        "name",
        "kind",
        "test_copy",
        "seeded_data"
      ],
      "additionalProperties": false
    },
    "allowed_for_transact": {
      "default": [],
      "type": "array",
      "items": {
        "type": "string",
        "format": "uri"
      }
    },
    "payment_test_mode": {
      "default": false,
      "type": "boolean"
    },
    "mask_personal_data": {
      "default": true,
      "type": "boolean"
    }
  },
  "required": [
    "id",
    "out_dir",
    "environment",
    "allowed_for_transact",
    "payment_test_mode",
    "mask_personal_data"
  ],
  "additionalProperties": false
}
