{
  "id": "mclaren-accord-2026-10-15-live",
  "out_dir": "walks/mclaren-accord/2026-10-15-live",
  "environment": { "name": "mclarenaccord.com live, logged out", "kind": "live", "test_copy": false, "seeded_data": false },
  "allowed_for_transact": [],
  "payment_test_mode": false,
  "mask_personal_data": true
}
