{
  "id": "cc-2026-10-14-live-pass-2",
  "out_dir": "walks/comunidad-connect/2026-10-14-live/pass-2",
  "environment": { "name": "comunidadconnect.org (live, logged out)", "kind": "live", "test_copy": false, "seeded_data": false },
  "allowed_for_transact": [],
  "payment_test_mode": false,
  "mask_personal_data": true
}
